{
  "$schema": "https://json-schema.org/draft/2020-12/schema",
  "$id": "https://cristiannichifor.github.io/romania-reforms/schema/cost.schema.json",
  "title": "The annual cost of the network, beside what the consolidation claims to save",
  "description": "The page the simulator exists to produce. Consolidation is argued as an administrative saving; to the person who has to reach the centre it is a journey with a price. Both come from the same scenario and sit in one document so neither can be quoted without the other. This is a cost and not a subsidy: no demand model and no fare revenue exist anywhere in this repository.",
  "type": "object",
  "additionalProperties": false,
  "required": [
    "id",
    "title",
    "publisher",
    "period",
    "provenance",
    "perWeekday",
    "fleet",
    "annualRon",
    "ledgerRon",
    "speedCheck",
    "limitations",
    "drivers"
  ],
  "properties": {
    "$schema": {
      "type": "string"
    },
    "id": {
      "type": "string"
    },
    "title": {
      "type": "string"
    },
    "publisher": {
      "type": "string"
    },
    "period": {
      "type": "string"
    },
    "provenance": {
      "$ref": "provenance.schema.json#/$defs/provenance"
    },
    "perWeekday": {
      "type": "object",
      "additionalProperties": false,
      "required": [
        "busHours",
        "busKm",
        "kmPerBusHour",
        "routesCosted",
        "routesWithoutLength",
        "paidDriverHours",
        "duties"
      ],
      "properties": {
        "busHours": {
          "type": "number",
          "exclusiveMinimum": 0
        },
        "busKm": {
          "type": "number",
          "exclusiveMinimum": 0
        },
        "kmPerBusHour": {
          "description": "Commercial speed. A stopping rural service usually runs 25-40 km/h; well above that means the timetable is faster than a bus.",
          "type": "number",
          "exclusiveMinimum": 0
        },
        "routesCosted": {
          "type": "integer",
          "minimum": 1
        },
        "routesWithoutLength": {
          "type": "integer",
          "minimum": 0
        },
        "paidDriverHours": {
          "description": "Paid driver-hours, which exceed bus-hours by more than the sign-on ratio: a peak-only route buys three hours of driving across a twelve-hour day, and the day is what is staffed.",
          "type": "number",
          "minimum": 0
        },
        "duties": {
          "description": "Shifts to roster a weekday. Bounded by EU 561/2006's nine driving hours and by how much of the day one duty may span.",
          "type": "integer",
          "minimum": 0
        }
      }
    },
    "speedCheck": {
      "type": "object",
      "additionalProperties": false,
      "description": "The model's commercial speed against recorded Romanian journeys. Published rather than only printed so the check is quotable and can be regression-tested. `tuned` records that the service-speed factor was fixed before the observations existed and was not moved to close the gap — if it ever is, this is a fit and not a test, and the flag must change with it.",
      "required": ["modelledKmh", "observedKmh", "observedP25Kmh", "observedP75Kmh", "observedJourneys", "gap", "source", "tuned"],
      "properties": {
        "modelledKmh": { "type": "number", "exclusiveMinimum": 0 },
        "observedKmh": { "type": "number", "exclusiveMinimum": 0 },
        "observedP25Kmh": { "type": "number", "exclusiveMinimum": 0 },
        "observedP75Kmh": { "type": "number", "exclusiveMinimum": 0 },
        "observedJourneys": { "type": "integer", "exclusiveMinimum": 0 },
        "gap": { "type": "number" },
        "source": { "type": "string" },
        "tuned": { "type": "boolean" }
      }
    },
    "fleet": {
      "type": "object",
      "additionalProperties": false,
      "required": [
        "byClass",
        "peakByClass",
        "total",
        "spareRatio"
      ],
      "properties": {
        "byClass": {
          "type": "object",
          "additionalProperties": {
            "type": "integer",
            "minimum": 0
          }
        },
        "peakByClass": {
          "type": "object",
          "additionalProperties": {
            "type": "integer",
            "minimum": 0
          }
        },
        "total": {
          "type": "integer",
          "minimum": 1
        },
        "spareRatio": {
          "type": "number",
          "minimum": 0
        }
      }
    },
    "annualRon": {
      "description": "Kept in the pieces it was built from, because a reader disputing the driver wage should not have to unpick a single total.",
      "type": "object",
      "additionalProperties": false,
      "required": [
        "driver",
        "running",
        "standing",
        "admin",
        "operating",
        "capital",
        "total"
      ],
      "properties": {
        "driver": {
          "type": "number",
          "minimum": 0
        },
        "running": {
          "type": "number",
          "minimum": 0
        },
        "standing": {
          "type": "number",
          "minimum": 0
        },
        "admin": {
          "type": "number",
          "minimum": 0
        },
        "operating": {
          "type": "number",
          "minimum": 0
        },
        "capital": {
          "type": "number",
          "minimum": 0
        },
        "total": {
          "type": "number",
          "minimum": 0
        }
      }
    },
    "ledgerRon": {
      "description": "Both columns of the argument, from one consolidation scenario.",
      "type": "object",
      "additionalProperties": false,
      "required": [
        "transportCost",
        "administrativeSaving",
        "operatingSaving",
        "netAgainstAdministrativeSaving"
      ],
      "properties": {
        "transportCost": {
          "type": "number",
          "minimum": 0
        },
        "administrativeSaving": {
          "type": "number"
        },
        "operatingSaving": {
          "type": "number"
        },
        "netAgainstAdministrativeSaving": {
          "type": "number"
        }
      }
    },
    "limitations": {
      "type": "array",
      "minItems": 1,
      "items": {
        "$ref": "provenance.schema.json#/$defs/limitation"
      }
    },
    "drivers": {
      "description": "Full-time drivers. Not the same as buses and always more of them: a driver is staffed against the vehicle's DAY, so a bus out from 06:00 to 22:00 needs two duties however little it moves.",
      "type": "integer",
      "minimum": 0
    }
  }
}
