{
  "$schema": "../schema/cost.schema.json",
  "id": "cost",
  "title": "Costul anual al rețelei, față de economia pe care o revendică comasarea",
  "publisher": "Cristian Nichifor",
  "period": "2026",
  "provenance": {
    "source": "retea-plus-preturi-unitare",
    "locator": "orele și kilometrii din data/network.json, prețurile unitare din data/cost-inputs.json, economiile din data/hubs.json",
    "confidence": "derived",
    "note": "Derivat dintr-un lanț verificat în ansamblu, nu pe verigi: viteza comercială care rezultă se compară cu 552 curse reale din programele județene și cade în intervalul lor, însă prețurile unitare rămân în parte estimate, iar economiile vin de la simulatorul administrativ cu limitările lui."
  },
  "drivers": 5552,
  "perWeekday": {
    "busHours": 27670.3,
    "paidDriverHours": 43964.8,
    "duties": 6538,
    "busKm": 1018343.8,
    "kmPerBusHour": 36.8,
    "routesCosted": 1707,
    "routesWithoutLength": 1
  },
  "fleet": {
    "byClass": {
      "feeder": 1930,
      "basic": 594,
      "trunk": 1533
    },
    "peakByClass": {
      "feeder": 1678,
      "basic": 516,
      "trunk": 1333
    },
    "total": 4057,
    "spareRatio": 0.15
  },
  "speedCheck": {
    "modelledKmh": 36.8,
    "observedKmh": 38.2,
    "observedP25Kmh": 31.6,
    "observedP75Kmh": 45.0,
    "observedJourneys": 552,
    "gap": -0.0366,
    "source": "data/observed-journeys.json",
    "tuned": false
  },
  "annualRon": {
    "driver": 510092298,
    "running": 1000378927,
    "standing": 51860631,
    "admin": 187479823,
    "operating": 1749811678,
    "capital": 276441961,
    "total": 2026253639
  },
  "ledgerRon": {
    "transportCost": 2026253639,
    "administrativeSaving": 8727843155,
    "operatingSaving": 32651674949,
    "netAgainstAdministrativeSaving": 6701589516
  },
  "limitations": [
    {
      "id": "cost-nu-subventie",
      "text": "Este costul serviciului, nu subvenția. Diferența se calculează în data/fares.json, care pune tarife pe kilometru-călător din hotărâri de consiliu județean peste o cerere extrapolată din populație și scoate o acoperire din bilete de circa 46%. Rămâne o limitare care blochează citirea directă: cifra de aici nu este subvenția, iar cea din fares.json atârnă complet de gradul de ocupare, care este parametrul liber al acelui nivel. O versiune anterioară a acestei limitări spunea că nu există niciun model de cerere și niciun venit din bilete în depozit, ceea ce a încetat să fie adevărat când s-a construit fares.json.",
      "severity": "blocking",
      "affects": [
        "cost"
      ]
    },
    {
      "id": "preturile-nu-sunt-citate",
      "text": "O parte dintre prețurile unitare din data/cost-inputs.json au sursă publică — salariul șoferului, motorina fără TVA, rovinieta, prețurile de referință ale vehiculelor, durata anvelopelor — iar întreținerea este derivată dintr-un reper european ajustat salarial. Fără sursă rămân anvelopele pe kilometru, asigurarea, gararea și cota de administrație. Fiecare poziție își poartă propria proveniență în fișier: o versiune anterioară a acestei limitări spunea că niciun preț nu are sursă, ceea ce nu mai este adevărat de la sursarea salariului și a motorinei.",
      "severity": "material",
      "affects": [
        "cost"
      ]
    },
    {
      "id": "vitezele-sunt-verificate-doar-in-ansamblu",
      "text": "Viteza comercială a modelului este 36,80 km/h, față de 38,20 km/h măsurați pe 552 curse reale din programele de transport a șase consilii județene (data/observed-journeys.json), adică o abatere de -3.7%, în interiorul intervalului intercuartilic observat de 31,60-45,00 km/h. Factorul de viteză de serviciu NU a fost ajustat ca să închidă diferența — altfel singura verificare independentă din depozit ar fi devenit o potrivire. Ce rămâne neverificat este descompunerea: lanțul se verifică în ansamblu, iar un model care ar merge prea repede pe drum și ar staționa prea mult în stație ar cădea în același loc. Vezi și limitările din data/observed-journeys.json privind eșantionul.",
      "severity": "note",
      "affects": [
        "cost"
      ]
    },
    {
      "id": "factorul-de-viteza-de-serviciu",
      "text": "Timpii de drum liber sunt împărțiți la un factor de 0,75 ca să devină timpi de serviciu — intersecții, marja pusă în orar ca traseul să poată fi respectat, conducerea unui vehicul greu. Factorul este presupus, presupus, fixat înainte să existe observațiile, și este presupunerea cu cea mai mare influență asupra orelor. Nu a fost mutat după ce au apărut cele 552 curse măsurate, tocmai ca verificarea vitezei comerciale să rămână un test și să nu devină o potrivire. Opririle nu sunt în el: staționarea se socotește separat, iar frânarea și repornirea din stație au fost măsurate și fac 3%.",
      "severity": "material",
      "affects": [
        "cost"
      ]
    },
    {
      "id": "reperul-buzau-nu-se-poate-converti",
      "text": "Costul de funcționare iese 6,87 lei pe kilometru, față de circa 9 lei cât ar fi o operare rurală vest-europeană cu partea de salarii ajustată la nivelul românesc — deci verificarea care se poate face TRECE. Ce nu se poate face este conversia tarifului aprobat la Buzău în 2025, 0,35 lei/km/loc: metodologia ANRSC împarte costul pe kilometru-vehicul la numărul mediu de LOCURI, iar costul pe kilometru nu crește proporțional cu locurile — același șofer, aceleași anvelope, ceva mai multă motorină. Înmulțirea cu numărul de locuri nu corespunde nici unei mărimi reale, iar compoziția parcului din Buzău, care ar fi singura cale de conversie, este într-un PDF scanat. Cifra rămâne consemnată pentru că este singura măsurătoare românească de exploatare găsită, dar nu este un test picat: este un test care nu se poate da.",
      "severity": "note",
      "affects": [
        "cost"
      ]
    },
    {
      "id": "economiile-sunt-ale-altui-simulator",
      "text": "Economiile administrative și de funcționare sunt calculate de simulatorul administrativ, preluate ca atare, cu limitările lui. Comparația are sens doar în cadrul aceluiași scenariu de comasare.",
      "severity": "material",
      "affects": [
        "cost"
      ]
    }
  ]
}
